{
  "$schema": "./sprite-behaviors.schema.json",
  "metadata": {
    "id": "codex-dashboard-sprite-behaviors",
    "version": "1.0.0",
    "schemaVersion": "1.0.0",
    "locale": "pt-BR",
    "description": "Comportamentos declarativos dos sprites do painel Codex."
  },
  "macros": {
    "hora": {
      "token": "{{hora}}",
      "origin": "relógio do painel",
      "sourcePath": "clock.time",
      "type": "string",
      "unit": "",
      "fallback": "horário indisponível",
      "description": "Hora local formatada."
    },
    "data": {
      "token": "{{data}}",
      "origin": "relógio do painel",
      "sourcePath": "clock.date",
      "type": "string",
      "unit": "",
      "fallback": "data indisponível",
      "description": "Data local formatada."
    },
    "tempo_sem_interacao": {
      "token": "{{tempo_sem_interacao}}",
      "origin": "interação no painel",
      "sourcePath": "idleSeconds",
      "type": "duration",
      "unit": "s",
      "fallback": "tempo indisponível",
      "description": "Tempo desde a última interação do usuário no painel."
    },
    "temperatura": {
      "token": "{{temperatura}}",
      "origin": "telemetria de clima",
      "sourcePath": "weather.temperatureC",
      "type": "number",
      "unit": "°C",
      "fallback": "temperatura indisponível",
      "description": "Temperatura externa atual."
    },
    "clima": {
      "token": "{{clima}}",
      "origin": "telemetria de clima",
      "sourcePath": "weather.condition",
      "type": "string",
      "unit": "",
      "fallback": "clima indisponível",
      "description": "Descrição da condição climática."
    },
    "cpu": {
      "token": "{{cpu}}",
      "origin": "telemetria da máquina",
      "sourcePath": "machine.cpuPercent",
      "type": "number",
      "unit": "%",
      "fallback": "CPU indisponível",
      "description": "Uso atual de CPU."
    },
    "ram": {
      "token": "{{ram}}",
      "origin": "telemetria da máquina",
      "sourcePath": "machine.memoryPercent",
      "type": "number",
      "unit": "%",
      "fallback": "RAM indisponível",
      "description": "Uso atual de memória RAM."
    },
    "disco": {
      "token": "{{disco}}",
      "origin": "telemetria da máquina",
      "sourcePath": "machine.diskPercent",
      "type": "number",
      "unit": "%",
      "fallback": "disco indisponível",
      "description": "Uso atual do disco principal."
    },
    "gpu": {
      "token": "{{gpu}}",
      "origin": "telemetria opcional da máquina via nvidia-smi",
      "sourcePath": "machine.gpuPercent",
      "type": "number",
      "unit": "%",
      "fallback": "GPU indisponível",
      "description": "Uso máximo das GPUs NVIDIA quando nvidia-smi estiver disponível."
    },
    "gpu_memoria": {
      "token": "{{gpu_memoria}}",
      "origin": "telemetria opcional da máquina via nvidia-smi",
      "sourcePath": "machine.gpuMemoryPercent",
      "type": "number",
      "unit": "%",
      "fallback": "memória da GPU indisponível",
      "description": "Uso agregado da memória das GPUs NVIDIA quando disponível."
    },
    "codex_5h_percentual": {
      "token": "{{codex_5h_percentual}}",
      "origin": "coleta CDP do Codex",
      "sourcePath": "codex.fiveHourPercent",
      "type": "number",
      "unit": "%",
      "fallback": "limite de 5h indisponível",
      "description": "Percentual restante na janela de cinco horas."
    },
    "codex_5h_reset": {
      "token": "{{codex_5h_reset}}",
      "origin": "coleta CDP do Codex",
      "sourcePath": "codex.fiveHourResetSeconds",
      "type": "duration",
      "unit": "s",
      "fallback": "reset de 5h indisponível",
      "description": "Tempo restante até o reset da janela de cinco horas."
    },
    "codex_5h_atingido": {
      "token": "{{codex_5h_atingido}}",
      "origin": "coleta CDP do Codex",
      "sourcePath": "codex.fiveHourLimitReached",
      "type": "boolean",
      "unit": "",
      "fallback": false,
      "description": "Indica se o limite de cinco horas foi atingido."
    },
    "codex_semanal_percentual": {
      "token": "{{codex_semanal_percentual}}",
      "origin": "coleta CDP do Codex",
      "sourcePath": "codex.weeklyPercent",
      "type": "number",
      "unit": "%",
      "fallback": "limite semanal indisponível",
      "description": "Percentual restante no limite semanal."
    },
    "codex_semanal_reset": {
      "token": "{{codex_semanal_reset}}",
      "origin": "coleta CDP do Codex",
      "sourcePath": "codex.weeklyResetSeconds",
      "type": "duration",
      "unit": "s",
      "fallback": "reset semanal indisponível",
      "description": "Tempo restante até o reset semanal."
    },
    "codex_semanal_atingido": {
      "token": "{{codex_semanal_atingido}}",
      "origin": "coleta CDP do Codex",
      "sourcePath": "codex.weeklyLimitReached",
      "type": "boolean",
      "unit": "",
      "fallback": false,
      "description": "Indica se o limite semanal foi atingido."
    },
    "coleta_status": {
      "token": "{{coleta_status}}",
      "origin": "saúde da coleta",
      "sourcePath": "collection.status",
      "type": "string",
      "unit": "",
      "fallback": "status indisponível",
      "description": "Estado atual da coleta de dados."
    },
    "ultima_atualizacao": {
      "token": "{{ultima_atualizacao}}",
      "origin": "saúde da coleta",
      "sourcePath": "collection.collectedAtMs",
      "type": "datetime",
      "unit": "",
      "fallback": "atualização indisponível",
      "description": "Data e hora da última coleta válida."
    }
  },
  "cards": {
    "hora": "#card-clock",
    "interacao": "#card-idle",
    "temperatura": "#card-weather",
    "maquina": "#card-machine",
    "codex_5h": "#card-five-hour",
    "codex_semanal": "#card-weekly",
    "status": "#statusBadge"
  },
  "defaultBehavior": {
    "enabled": true,
    "initialState": "idle",
    "speed": 70,
    "reactionDurationSeconds": 4,
    "walkDurationSeconds": {
      "min": 2,
      "max": 6
    },
    "restDurationSeconds": {
      "min": 2,
      "max": 5
    },
    "actionIntervalSeconds": {
      "min": 5,
      "max": 12
    },
    "allowedDestinations": [
      "hora",
      "interacao",
      "temperatura",
      "maquina",
      "codex_5h",
      "codex_semanal"
    ],
    "casualSpeech": {
      "enabled": true,
      "intervalSeconds": {
        "min": 20,
        "max": 45
      },
      "phraseIds": [
        "casual_hora",
        "casual_clima",
        "casual_maquina",
        "casual_codex"
      ]
    },
    "features": {
      "reactions": true,
      "movement": true,
      "speech": true
    },
    "coordination": {
      "maxConcurrentReactions": 1,
      "duplicatePhraseWindowSeconds": 30,
      "minimumSpriteGapPixels": 12
    },
    "motion": {
      "returnToFreeRoam": true,
      "avoidCollisions": true,
      "respectViewport": true,
      "preserveDrag": true,
      "safePlacement": "safe-area",
      "reducedMotion": {
        "honorPreference": true,
        "disableWalking": true,
        "reactionDurationSeconds": 5
      }
    }
  },
  "phrases": [
    {
      "id": "casual_hora",
      "texts": [
        "Agora são {{hora}}.",
        "Hoje é {{data}}."
      ],
      "weight": 1
    },
    {
      "id": "casual_clima",
      "texts": [
        "Clima: {{clima}}.",
        "Temperatura: {{temperatura}}°C."
      ],
      "weight": 1
    },
    {
      "id": "casual_maquina",
      "texts": [
        "CPU: {{cpu}}%. RAM: {{ram}}%.",
        "Disco: {{disco}}%."
      ],
      "weight": 1
    },
    {
      "id": "casual_codex",
      "texts": [
        "Janela de 5h: {{codex_5h_percentual}}%.",
        "Semanal: {{codex_semanal_percentual}}%."
      ],
      "weight": 1
    }
  ],
  "triggers": [
    {
      "id": "codex_5h_normal",
      "enabled": true,
      "when": {
        "metric": "codex_5h_percentual",
        "operator": ">",
        "value": 60
      },
      "targetCard": "codex_5h",
      "spriteState": "happy",
      "phrases": [
        "Janela de 5h tranquila: {{codex_5h_percentual}}%."
      ],
      "priority": 20,
      "cooldownSeconds": 900
    },
    {
      "id": "codex_5h_visita",
      "enabled": true,
      "when": {
        "all": [
          {
            "metric": "codex_5h_percentual",
            "operator": ">",
            "value": 30
          },
          {
            "metric": "codex_5h_percentual",
            "operator": "<=",
            "value": 60
          }
        ]
      },
      "targetCard": "codex_5h",
      "spriteState": "inspect",
      "phrases": [
        "Janela de 5h: {{codex_5h_percentual}}%. Estou de olho."
      ],
      "priority": 65,
      "cooldownSeconds": 240
    },
    {
      "id": "codex_5h_preocupado",
      "enabled": true,
      "when": {
        "metric": "codex_5h_percentual",
        "operator": "between",
        "value": [
          10,
          30
        ]
      },
      "targetCard": "codex_5h",
      "spriteState": "worried",
      "phrases": [
        "Restam {{codex_5h_percentual}}% na janela de 5h."
      ],
      "priority": 90,
      "cooldownSeconds": 180
    },
    {
      "id": "codex_5h_critico",
      "enabled": true,
      "when": {
        "any": [
          {
            "metric": "codex_5h_percentual",
            "operator": "<",
            "value": 10
          },
          {
            "metric": "codex_5h_atingido",
            "operator": "==",
            "value": true
          }
        ]
      },
      "targetCard": "codex_5h",
      "spriteState": "critical",
      "phrases": [
        "Janela de 5h crítica. Reset: {{codex_5h_reset}}."
      ],
      "priority": 110,
      "cooldownSeconds": 90,
      "persistent": true,
      "holdSeconds": 5
    },
    {
      "id": "codex_5h_reset_proximo",
      "enabled": true,
      "when": {
        "all": [
          {
            "metric": "codex_5h_reset",
            "operator": ">",
            "value": 0
          },